[
    {
        "users": ["mmouse", "dduck"],
        "jobs": ["job1", "job2"],
        "sort": [{
            "key": "name",
            "direction": "ascending"
        }],
        "search": {
            "terms": ["cheese"]
        },
        "date_range": {
            "from": 0,
            "to": 1000
        },
        "client_groups": ["njs"],
        "offset": 0,
        "limit": 100
    }
]